{
    "meta":  {
                 "title":  "software-engineering-agent-mock-demo",
                 "version":  "1.1.0-mock"
             },
    "layout":  {
                   "type":  "fixed-vertical-layers",
                   "layerCount":  5,
                   "moduleRowWrap":  false,
                   "edgeRouting":  "auto",
                   "theme":  {
                                 "defaultEdgeColor":  "#5f676d",
                                 "emphasisEdgeColor":  "#57bd84",
                                 "layerBorderColor":  "#27336b",
                                 "nodeBorderColor":  "#1b1b1b"
                             }
               },
    "overview":  {
                     "nodes":  [
                                   {
                                       "id":  "overview.requirement_alignment",
                                       "label":  "需求对齐",
                                       "asset":  {
                                                     "name":  "需求对齐",
                                                     "type":  "其他",
                                                     "dependencies":  [

                                                                      ],
                                                     "links":  [
                                                                   {
                                                                       "label":  "资产文档",
                                                                       "url":  "https://example.com/docs/overview.requirement_alignment"
                                                                   },
                                                                   {
                                                                       "label":  "代码仓库",
                                                                       "url":  "https://example.com/repos/overview.requirement_alignment"
                                                                   }
                                                               ],
                                                     "stages":  [
                                                                    "常驻"
                                                                ],
                                                     "effect":  "需求对齐 用于表达全局研发方向中的关键活动。",
                                                     "implemented":  true,
                                                     "note":  "顶部方向图节点，独立于五层资产结构。"
                                                 }
                                   },
                                   {
                                       "id":  "overview.solution_design",
                                       "label":  "方案设计",
                                       "asset":  {
                                                     "name":  "方案设计",
                                                     "type":  "其他",
                                                     "dependencies":  [

                                                                      ],
                                                     "links":  [
                                                                   {
                                                                       "label":  "资产文档",
                                                                       "url":  "https://example.com/docs/overview.solution_design"
                                                                   },
                                                                   {
                                                                       "label":  "代码仓库",
                                                                       "url":  "https://example.com/repos/overview.solution_design"
                                                                   }
                                                               ],
                                                     "stages":  [
                                                                    "常驻"
                                                                ],
                                                     "effect":  "方案设计 用于表达全局研发方向中的关键活动。",
                                                     "implemented":  true,
                                                     "note":  "顶部方向图节点，独立于五层资产结构。"
                                                 }
                                   },
                                   {
                                       "id":  "overview.coding",
                                       "label":  "编码实现",
                                       "asset":  {
                                                     "name":  "编码实现",
                                                     "type":  "其他",
                                                     "dependencies":  [

                                                                      ],
                                                     "links":  [
                                                                   {
                                                                       "label":  "资产文档",
                                                                       "url":  "https://example.com/docs/overview.coding"
                                                                   },
                                                                   {
                                                                       "label":  "代码仓库",
                                                                       "url":  "https://example.com/repos/overview.coding"
                                                                   }
                                                               ],
                                                     "stages":  [
                                                                    "常驻"
                                                                ],
                                                     "effect":  "编码实现 用于表达全局研发方向中的关键活动。",
                                                     "implemented":  true,
                                                     "note":  "顶部方向图节点，独立于五层资产结构。"
                                                 }
                                   },
                                   {
                                       "id":  "overview.issue_convergence",
                                       "label":  "问题收敛",
                                       "asset":  {
                                                     "name":  "问题收敛",
                                                     "type":  "其他",
                                                     "dependencies":  [

                                                                      ],
                                                     "links":  [
                                                                   {
                                                                       "label":  "资产文档",
                                                                       "url":  "https://example.com/docs/overview.issue_convergence"
                                                                   },
                                                                   {
                                                                       "label":  "代码仓库",
                                                                       "url":  "https://example.com/repos/overview.issue_convergence"
                                                                   }
                                                               ],
                                                     "stages":  [
                                                                    "常驻"
                                                                ],
                                                     "effect":  "问题收敛 用于表达全局研发方向中的关键活动。",
                                                     "implemented":  true,
                                                     "note":  "顶部方向图节点，独立于五层资产结构。"
                                                 }
                                   }
                               ]
                 },
    "layers":  [
                   {
                       "id":  "layer.top",
                       "label":  "阶段输出件",
                       "order":  1,
                       "kind":  "ellipse-row",
                       "frame":  false,
                       "slots":  5,
                       "nodeDefaults":  {
                                            "shape":  "ellipse",
                                            "size":  "large"
                                        }
                   },
                   {
                       "id":  "layer.inputs",
                       "label":  "审核门禁",
                       "order":  2,
                       "kind":  "rect-row",
                       "frame":  true,
                       "slots":  5,
                       "nodeDefaults":  {
                                            "shape":  "rect",
                                            "size":  "small"
                                        }
                   },
                   {
                       "id":  "layer.context",
                       "label":  "规范资产\n（常驻会话）",
                       "order":  3,
                       "kind":  "rect-row",
                       "frame":  true,
                       "slots":  3,
                       "nodeDefaults":  {
                                            "shape":  "rect",
                                            "size":  "medium"
                                        }
                   },
                   {
                       "id":  "layer.modules",
                       "label":  "能力资产\n（阶段触发）",